{
    "id": "steel_astm_a36",
    "name": "Acier Carbone ASTM A36 (Fy=250 MPa)",
    "category": "Steel",
    "version": "1.0.0",
    "standard": {
        "name": "ASTM A36 / AISC 360",
        "edition": "2019",
        "clause": "Table 2-4",
        "source": "ASTM International"
    },
    "mechanical": {
        "density": { "value": 7850.0, "unit": "kg/m3" },
        "young_modulus": { "value": 200000.0, "unit": "MPa" },
        "poisson_ratio": 0.30,
        "thermal_coeff": { "value": 1.2e-5, "unit": "1/K" }
    },
    "strength": {
        "fy": { "value": 250.0, "unit": "MPa" },
        "ft": { "value": 400.0, "unit": "MPa" }
    },
    "visual": {
        "base_color": "#5A738E",
        "roughness": 0.40,
        "metallic": 0.85,
        "textures": { "albedo": "Textures/steel.png" }
    }
}
