{
    "id": "timber_d40_oak",
    "name": "Bois Feuillu Chêne D40",
    "category": "Timber",
    "version": "1.0.0",
    "standard": {
        "name": "EN 338 / EN 1995-1-1",
        "edition": "2016",
        "clause": "Tableau 1 - Classe D40 (Feuillus)",
        "source": "CEN"
    },
    "mechanical": {
        "density": { "value": 700.0, "unit": "kg/m3" },
        "young_modulus": { "value": 13000.0, "unit": "MPa" },
        "poisson_ratio": 0.35,
        "thermal_coeff": { "value": 5.0e-6, "unit": "1/K" }
    },
    "strength": {
        "ft": { "value": 40.0, "unit": "MPa" }
    },
    "visual": {
        "base_color": "#8B5A2B",
        "roughness": 0.70,
        "metallic": 0.0,
        "textures": { "albedo": "Textures/wood.png" }
    }
}
