{
  "id": "concrete_c30_37",
  "name": "Concrete C30/37",
  "category": "Concrete",
  "version": "1.0.0",
  "standard": {
    "name": "EN 1992-1-1",
    "edition": "2004",
    "clause": "Table 3.1",
    "source": "CEN"
  },
  "mechanical": {
    "density": { "value": 2500.0, "unit": "kg/m3" },
    "young_modulus": { "value": 33000.0, "unit": "MPa" },
    "poisson_ratio": 0.20,
    "thermal_coeff": { "value": 1.0e-5, "unit": "1/K" }
  },
  "strength": {
    "fck": { "value": 30.0, "unit": "MPa" }
  },
  "visual": {
    "base_color": "#8F9295",
    "roughness": 0.85,
    "metallic": 0.0,
    "transparency": 0.0,
    "shininess": 0.10,
    "textures": {},
    "texture_scale_u": 1.0,
    "texture_scale_v": 1.0
  }
}
