{
    "id": "timber_c24_nordic",
    "name": "Bois Massif Résineux Nordique C24",
    "category": "Timber",
    "version": "1.0.0",
    "standard": {
        "name": "EN 338 / EN 1995-1-1",
        "edition": "2016",
        "clause": "Tableau 1 - Classe C24",
        "source": "CEN"
    },
    "mechanical": {
        "density": { "value": 420.0, "unit": "kg/m3" },
        "young_modulus": { "value": 11000.0, "unit": "MPa" },
        "poisson_ratio": 0.30,
        "thermal_coeff": { "value": 5.0e-6, "unit": "1/K" }
    },
    "strength": {
        "ft": { "value": 24.0, "unit": "MPa" }
    },
    "visual": {
        "base_color": "#C49A45",
        "roughness": 0.75,
        "metallic": 0.0,
        "textures": { "albedo": "Textures/wood.png" }
    }
}
