{
    "id": "glulam_gl28h",
    "name": "Bois Lamellé-Collé GL28h",
    "category": "Timber",
    "version": "1.0.0",
    "standard": {
        "name": "EN 14080 / EN 1995-1-1",
        "edition": "2013",
        "clause": "Tableau 4 - Classes GLh",
        "source": "CEN"
    },
    "mechanical": {
        "density": { "value": 460.0, "unit": "kg/m3" },
        "young_modulus": { "value": 12600.0, "unit": "MPa" },
        "poisson_ratio": 0.30,
        "thermal_coeff": { "value": 5.0e-6, "unit": "1/K" }
    },
    "strength": {
        "ft": { "value": 28.0, "unit": "MPa" }
    },
    "visual": {
        "base_color": "#D2A679",
        "roughness": 0.68,
        "metallic": 0.0,
        "textures": { "albedo": "Textures/wood.png" }
    }
}
