{
  "id": "steel_galvanized",
  "name": "Galvanized Steel",
  "category": "Steel",
  "version": "1.0.0",
  "standard": {
    "name": "EN 10346",
    "edition": "2015",
    "clause": "Table 7",
    "source": "CEN"
  },
  "mechanical": {
    "density": { "value": 7850.0, "unit": "kg/m3" },
    "young_modulus": { "value": 210000.0, "unit": "MPa" },
    "poisson_ratio": 0.30,
    "thermal_coeff": { "value": 1.2e-5, "unit": "1/K" }
  },
  "strength": {
    "fy": { "value": 275.0, "unit": "MPa" }
  },
  "visual": {
    "base_color": "#B4BAC0",
    "roughness": 0.40,
    "metallic": 0.82,
    "transparency": 0.0,
    "shininess": 0.55,
    "textures": {},
    "texture_scale_u": 1.0,
    "texture_scale_v": 1.0
  }
}
