{
    "id": "steel_astm_a500_grb",
    "name": "Acier Tubes HSS ASTM A500 Gr. B (Fy=315 MPa)",
    "category": "Steel",
    "version": "1.0.0",
    "standard": {
        "name": "ASTM A500 / AISC 360",
        "edition": "2021",
        "clause": "Table 2-4 - HSS",
        "source": "ASTM International"
    },
    "mechanical": {
        "density": { "value": 7850.0, "unit": "kg/m3" },
        "young_modulus": { "value": 200000.0, "unit": "MPa" },
        "poisson_ratio": 0.30,
        "thermal_coeff": { "value": 1.2e-5, "unit": "1/K" }
    },
    "strength": {
        "fy": { "value": 315.0, "unit": "MPa" },
        "ft": { "value": 400.0, "unit": "MPa" }
    },
    "visual": {
        "base_color": "#3D566E",
        "roughness": 0.38,
        "metallic": 0.88,
        "textures": { "albedo": "Textures/steel.png" }
    }
}
